{
  "product_name": "แก้วทัมเบลอร์เก็บอุณหภูมิ 450ml พร้อมจอ LED แสดงอุณหภูมิ (SUS304)",
  "product_name_en": "Thermal Tumbler 450ml with Touch LED Temperature Display (Vacuum Cup)",
  "pricing_source_reconciliation": {
    "source_file": "01-ต้นทุน-20260612 Business Office Gift set catalog.xlsx",
    "source_row": 5846,
    "factory_item_code": "BW00-0",
    "factory_item_name": "Vacuum cup in simple dark blue gift bag packing",
    "factory_price_formula_usd": "=15/6.5",
    "factory_price_usd": 2.31,
    "currency_exchange_rate_formula": "=E5846*34",
    "fx_rate_thb_per_usd": 34.0,
    "factory_cost_thb_exact": 78.4615385,
    "factory_cost_thb_display": 78.46
  },
  "codes_and_identification": {
    "factory_base_model": "BW00",
    "product_items_suffix": "-0",
    "factory_item_code": "BW00-0",
    "package_suffix": "(P-BAG)",
    "package_name": "Dark Blue Premium Gift Bag with Handle",
    "flowaccount_product_code": "BW00-0(P-BAG)",
    "smartgift_internal_code": "PM-TMB",
    "product_family": "PF-DRINKWARE",
    "category": "eco-friendly"
  },
  "specifications": {
    "capacity": "450 ml",
    "dimensions": "Diameter 65 mm x Height 230 mm",
    "body_material": "SUS304 Stainless Steel Inner Liner (Food Grade, Vacuum Insulated)",
    "lid_features": "Touch Sensor Smart LED Temperature Display Ring, Leak-proof Silicone Seal",
    "thermal_performance": "Keep Warm 6-12 hrs / Keep Cold 12-24 hrs",
    "weight": "Approx 320g"
  },
  "colors_available": [
    {
      "color_en": "Blue",
      "color_th": "น้ำเงินคลาสสิก",
      "hex": "#1E3A8A"
    },
    {
      "color_en": "Silver",
      "color_th": "เงินสแตนเลสเมทัลลิก",
      "hex": "#94A3B8"
    },
    {
      "color_en": "Black",
      "color_th": "ดำด้านพรีเมียม (Matte Black)",
      "hex": "#1E293B"
    },
    {
      "color_en": "Red",
      "color_th": "แดงทับทิม",
      "hex": "#DC2626"
    },
    {
      "color_en": "Gold",
      "color_th": "ทองแชมเปญ",
      "hex": "#D97706"
    },
    {
      "color_en": "Pink",
      "color_th": "ชมพูโรสโกลด์",
      "hex": "#F472B6"
    },
    {
      "color_en": "Orange",
      "color_th": "ส้มสปอร์ต",
      "hex": "#EA580C"
    },
    {
      "color_en": "Light Blue",
      "color_th": "ฟ้าพาสเทล",
      "hex": "#38BDF8"
    }
  ],
  "packaging_options": [
    {
      "package_code": "P-BAG",
      "name": "ถุงของขวัญ Dark Blue Gift Bag พร้อมหูหิ้ว (รวมในชุดมาตรฐาน)",
      "cost_included": true
    },
    {
      "package_code": "P-01",
      "name": "กล่องของขวัญเดี่ยวแบบแข็งเปิดฝาบน พร้อมโฟม EVA เข้ารูป",
      "additional_cost_thb": 25.0
    },
    {
      "package_code": "P-TUBE",
      "name": "กระบอกของขวัญทรงกลมลายคราฟท์/ดำ ปั๊มฟอยล์",
      "additional_cost_thb": 20.0
    }
  ],
  "shipping_options": {
    "model": "Direct Single Drop (Port-to-Client)",
    "flat_rate_trip_thb": 2500.0,
    "sea_freight_cbm_rate": 2800.0,
    "cbm_per_unit": 0.002508,
    "units_per_carton": 30,
    "carton_dimensions_cm": "45 x 38 x 44 cm (0.07524 CBM)",
    "corporate_quotation_display": "0.00 THB (ฟรีค่าจัดส่ง รวมในต้นทุนต่อชุดเรียบร้อยแล้ว)"
  },
  "pricing_comparison_table": [
    {
      "quantity": 50,
      "factory_base_code": "BW00",
      "items_in_set": 0,
      "factory_item_code": "BW00-0",
      "package_code": "P-BAG",
      "flowaccount_product_code": "BW00-0(P-BAG)",
      "smartgift_product_code": "PM-TMB",
      "factory_exw_usd": 2.31,
      "factory_exw_thb": 78.46,
      "factory_exw_thb_exact": 78.4615385,
      "fx_rate": 34.0,
      "sea_freight_thb": 7.02,
      "customization_thb": 10.0,
      "domestic_freight_thb": 50.0,
      "total_landed_cost_thb": 145.48,
      "standard_selling_price_thb": 250.0,
      "standard_gross_profit_unit": 104.52,
      "standard_gross_profit_total": 5225.92,
      "standard_gross_margin_pct": 41.8,
      "corporate_selling_price_thb": 210.0,
      "corporate_gross_profit_unit": 64.52,
      "corporate_gross_profit_total": 3226.0,
      "corporate_gross_margin_pct": 30.7,
      "corporate_savings_per_unit_thb": 40.0,
      "corporate_savings_total_thb": 2000.0
    },
    {
      "quantity": 100,
      "factory_base_code": "BW00",
      "items_in_set": 0,
      "factory_item_code": "BW00-0",
      "package_code": "P-BAG",
      "flowaccount_product_code": "BW00-0(P-BAG)",
      "smartgift_product_code": "PM-TMB",
      "factory_exw_usd": 2.31,
      "factory_exw_thb": 78.46,
      "factory_exw_thb_exact": 78.4615385,
      "fx_rate": 34.0,
      "sea_freight_thb": 7.02,
      "customization_thb": 10.0,
      "domestic_freight_thb": 25.0,
      "total_landed_cost_thb": 120.48,
      "standard_selling_price_thb": 230.0,
      "standard_gross_profit_unit": 109.52,
      "standard_gross_profit_total": 10951.85,
      "standard_gross_margin_pct": 47.6,
      "corporate_selling_price_thb": 169.0,
      "corporate_gross_profit_unit": 48.52,
      "corporate_gross_profit_total": 4851.85,
      "corporate_gross_margin_pct": 28.7,
      "corporate_savings_per_unit_thb": 61.0,
      "corporate_savings_total_thb": 6100.0
    },
    {
      "quantity": 300,
      "factory_base_code": "BW00",
      "items_in_set": 0,
      "factory_item_code": "BW00-0",
      "package_code": "P-BAG",
      "flowaccount_product_code": "BW00-0(P-BAG)",
      "smartgift_product_code": "PM-TMB",
      "factory_exw_usd": 2.31,
      "factory_exw_thb": 78.46,
      "factory_exw_thb_exact": 78.4615385,
      "fx_rate": 34.0,
      "sea_freight_thb": 7.02,
      "customization_thb": 10.0,
      "domestic_freight_thb": 8.33,
      "total_landed_cost_thb": 103.81,
      "standard_selling_price_thb": 215.0,
      "standard_gross_profit_unit": 111.19,
      "standard_gross_profit_total": 33355.54,
      "standard_gross_margin_pct": 51.7,
      "corporate_selling_price_thb": 149.0,
      "corporate_gross_profit_unit": 45.19,
      "corporate_gross_profit_total": 13555.54,
      "corporate_gross_margin_pct": 30.3,
      "corporate_savings_per_unit_thb": 66.0,
      "corporate_savings_total_thb": 19800.0
    },
    {
      "quantity": 500,
      "factory_base_code": "BW00",
      "items_in_set": 0,
      "factory_item_code": "BW00-0",
      "package_code": "P-BAG",
      "flowaccount_product_code": "BW00-0(P-BAG)",
      "smartgift_product_code": "PM-TMB",
      "factory_exw_usd": 2.31,
      "factory_exw_thb": 78.46,
      "factory_exw_thb_exact": 78.4615385,
      "fx_rate": 34.0,
      "sea_freight_thb": 7.02,
      "customization_thb": 10.0,
      "domestic_freight_thb": 5.0,
      "total_landed_cost_thb": 100.48,
      "standard_selling_price_thb": 200.0,
      "standard_gross_profit_unit": 99.52,
      "standard_gross_profit_total": 49759.23,
      "standard_gross_margin_pct": 49.8,
      "corporate_selling_price_thb": 139.0,
      "corporate_gross_profit_unit": 38.52,
      "corporate_gross_profit_total": 19259.23,
      "corporate_gross_margin_pct": 27.7,
      "corporate_savings_per_unit_thb": 61.0,
      "corporate_savings_total_thb": 30500.0
    },
    {
      "quantity": 1000,
      "factory_base_code": "BW00",
      "items_in_set": 0,
      "factory_item_code": "BW00-0",
      "package_code": "P-BAG",
      "flowaccount_product_code": "BW00-0(P-BAG)",
      "smartgift_product_code": "PM-TMB",
      "factory_exw_usd": 2.31,
      "factory_exw_thb": 78.46,
      "factory_exw_thb_exact": 78.4615385,
      "fx_rate": 34.0,
      "sea_freight_thb": 7.02,
      "customization_thb": 10.0,
      "domestic_freight_thb": 2.5,
      "total_landed_cost_thb": 97.98,
      "standard_selling_price_thb": 185.0,
      "standard_gross_profit_unit": 87.02,
      "standard_gross_profit_total": 87018.46,
      "standard_gross_margin_pct": 47.0,
      "corporate_selling_price_thb": 129.0,
      "corporate_gross_profit_unit": 31.02,
      "corporate_gross_profit_total": 31018.46,
      "corporate_gross_margin_pct": 24.0,
      "corporate_savings_per_unit_thb": 56.0,
      "corporate_savings_total_thb": 56000.0
    }
  ]
}
